{
  "id": "jazz",
  "type": "pack",
  "name": "Jazz",
  "about": "Jazz in C minor (the charts' C = 0) at a medium 120, swung eighths-feel sixteenths, a little room.",
  "author": "ravving",
  "version": "1.1.0",
  "license": "CC-BY-4.0",
  "tags": [
    "jazz",
    "natural minor",
    "120 bpm",
    "C minor"
  ],
  "minAppVersion": "0.4.0",
  "files": [
    "ravving"
  ]
}
